{
  "@context": "https://urn-solid.github.io/context.jsonld",
  "@id": "urn:solid:GeoCoordinates",
  "@type": "rdfs:Class",
  "rdfs:label": "GeoCoordinates",
  "rdfs:comment": "The geographic coordinates of a place — a latitude/longitude pair, optionally with elevation.",
  "owl:sameAs": "https://schema.org/GeoCoordinates",
  "rdfs:seeAlso": [
    "http://www.w3.org/2003/01/geo/wgs84_pos#Point",
    "urn:solid:hasGeo"
  ],
  "status": "stable",
  "added": "2026-04-18",
  "notes": "Carries `schema:latitude` and `schema:longitude` (decimal degrees, WGS-84) and optional `schema:elevation`. Use as the value of `schema:geo` on a Place. For a `geo:` URI shortcut, see `urn:solid:hasGeo`. For shapes (polygons), use `schema:GeoShape`.",
  "examples": [
    {
      "title": "Coordinates for a place",
      "jsonld": {
        "@context": "https://urn-solid.github.io/context.jsonld",
        "@id": "https://example.org/places/big-ben/geo",
        "@type": "urn:solid:GeoCoordinates",
        "https://schema.org/latitude": "51.5007",
        "https://schema.org/longitude": "-0.1246"
      }
    }
  ],
  "provenance": {
    "sources": [
      "https://schema.org/GeoCoordinates"
    ],
    "curatedBy": "claude-curate-next"
  },
  "history": [
    {
      "event": "added",
      "at": "2026-04-18T00:00:00Z",
      "by": "claude-curate-next",
      "note": "Initial term."
    }
  ],
  "see_also": {
    "corpus": "/corpus.jsonl",
    "schema": "/schema/term.schema.json",
    "index": "/index.json",
    "llms": "/llms.txt"
  }
}
