{
  "@context": "https://urn-solid.github.io/context.jsonld",
  "@id": "urn:solid:DigitalDocument",
  "@type": "rdfs:Class",
  "rdfs:label": "DigitalDocument",
  "rdfs:comment": "An electronic document — typically a file (PDF, spreadsheet, presentation, text file).",
  "owl:sameAs": "https://schema.org/DigitalDocument",
  "rdfs:seeAlso": [
    "urn:solid:Document",
    "urn:solid:CreativeWork",
    "https://schema.org/TextDigitalDocument",
    "https://schema.org/SpreadsheetDigitalDocument"
  ],
  "notToBeConfusedWith": [
    "urn:solid:Document"
  ],
  "status": "stable",
  "added": "2026-04-19",
  "notes": "Subclass of `urn:solid:CreativeWork`. Distinct from FOAF `urn:solid:Document` (any document, including web pages): DigitalDocument is specifically a file-as-document with subclasses for spreadsheets, presentations, text. Pair with `urn:solid:format` for the MIME type.",
  "examples": [
    {
      "title": "A PDF document",
      "jsonld": {
        "@context": "https://urn-solid.github.io/context.jsonld",
        "@id": "https://example.org/docs/spec.pdf",
        "@type": "urn:solid:DigitalDocument",
        "urn:solid:name": "v2 spec",
        "urn:solid:format": "application/pdf"
      }
    }
  ],
  "provenance": {
    "sources": [
      "https://schema.org/DigitalDocument"
    ],
    "curatedBy": "claude-curate-next"
  },
  "history": [
    {
      "event": "added",
      "at": "2026-04-19T00:00:00Z",
      "by": "claude-curate-next",
      "note": "Initial term."
    }
  ],
  "see_also": {
    "corpus": "/corpus.jsonl",
    "schema": "/schema/term.schema.json",
    "index": "/index.json",
    "llms": "/llms.txt"
  }
}
