{
  "@context": "https://urn-solid.github.io/context.jsonld",
  "@id": "urn:solid:sibling",
  "@type": "rdf:Property",
  "rdfs:label": "sibling",
  "rdfs:comment": "A sibling of the person — sharing at least one parent.",
  "owl:sameAs": "https://schema.org/sibling",
  "rdfs:seeAlso": [
    "urn:solid:parent",
    "urn:solid:children"
  ],
  "rdfs:domain": "urn:solid:Person",
  "rdfs:range": "urn:solid:Person",
  "status": "stable",
  "added": "2026-04-18",
  "notes": "Symmetric — if A is sibling of B, B is sibling of A. Use repeatedly for multiple siblings. Sensitive personal data; consider access control before publishing.",
  "examples": [
    {
      "title": "Person with a sibling",
      "jsonld": {
        "@context": "https://urn-solid.github.io/context.jsonld",
        "@id": "https://example.org/alice#me",
        "@type": "urn:solid:Person",
        "urn:solid:sibling": { "@id": "https://example.org/eve#me" }
      }
    }
  ],
  "provenance": {
    "sources": [
      "https://schema.org/sibling"
    ],
    "curatedBy": "claude-curate-next"
  },
  "history": [
    {
      "event": "added",
      "at": "2026-04-18T00:00:00Z",
      "by": "claude-curate-next",
      "note": "Initial term."
    }
  ],
  "see_also": {
    "corpus": "/corpus.jsonl",
    "schema": "/schema/term.schema.json",
    "index": "/index.json",
    "llms": "/llms.txt"
  }
}
