{
  "@context": "https://urn-solid.github.io/context.jsonld",
  "@id": "urn:solid:lastName",
  "@type": "rdf:Property",
  "rdfs:label": "lastName",
  "rdfs:comment": "The last name of a person.",
  "owl:sameAs": "http://xmlns.com/foaf/0.1/lastName",
  "rdfs:seeAlso": [
    "http://xmlns.com/foaf/0.1/familyName",
    "http://xmlns.com/foaf/0.1/surname"
  ],
  "rdfs:domain": "urn:solid:Person",
  "rdfs:range": "http://www.w3.org/2001/XMLSchema#string",
  "notToBeConfusedWith": [
    "urn:solid:familyName",
    "urn:solid:firstName"
  ],
  "status": "stable",
  "added": "2026-04-18",
  "notes": "Older sibling of `foaf:familyName` — kept for compatibility with legacy FOAF data. New profiles should prefer `urn:solid:familyName`. The first/last vs given/family terminology is culture-bound; treat them as equivalent in practice.",
  "examples": [
    {
      "title": "Person with first/last names",
      "jsonld": {
        "@context": "https://urn-solid.github.io/context.jsonld",
        "@id": "https://example.org/alice#me",
        "@type": "urn:solid:Person",
        "urn:solid:firstName": "Alice",
        "urn:solid:lastName": "Liddell"
      }
    }
  ],
  "provenance": {
    "sources": [
      "http://xmlns.com/foaf/0.1/lastName"
    ],
    "curatedBy": "claude-curate-next"
  },
  "history": [
    {
      "event": "added",
      "at": "2026-04-18T00:00:00Z",
      "by": "claude-curate-next",
      "note": "Initial term."
    }
  ],
  "see_also": {
    "corpus": "/corpus.jsonl",
    "schema": "/schema/term.schema.json",
    "index": "/index.json",
    "llms": "/llms.txt"
  }
}
