{
  "@context": "https://urn-solid.github.io/context.jsonld",
  "@id": "urn:solid:postIn",
  "@type": "rdf:Property",
  "rdfs:label": "postIn",
  "rdfs:comment": "Links a Post to the Organization in which it sits.",
  "owl:sameAs": "http://www.w3.org/ns/org#postIn",
  "rdfs:seeAlso": [
    "urn:solid:Post",
    "urn:solid:Organization",
    "urn:solid:heldBy"
  ],
  "rdfs:domain": "urn:solid:Post",
  "rdfs:range": "urn:solid:Organization",
  "status": "stable",
  "added": "2026-04-19",
  "notes": "Identifies which Organization owns the position. Use alongside `org:heldBy` (current holder) and an optional `org:role` (the abstract role the Post embodies) to fully describe a seat in an org chart.",
  "examples": [
    {
      "title": "A Post and the Organization it sits in",
      "jsonld": {
        "@context": "https://urn-solid.github.io/context.jsonld",
        "@id": "https://example.org/acme/posts/cto",
        "@type": "urn:solid:Post",
        "urn:solid:postIn": { "@id": "https://example.org/acme#org" }
      }
    }
  ],
  "provenance": {
    "sources": [
      "http://www.w3.org/ns/org#postIn"
    ],
    "curatedBy": "claude-curate-next"
  },
  "history": [
    {
      "event": "added",
      "at": "2026-04-19T00:00:00Z",
      "by": "claude-curate-next",
      "note": "Initial term."
    }
  ],
  "see_also": {
    "corpus": "/corpus.jsonl",
    "schema": "/schema/term.schema.json",
    "index": "/index.json",
    "llms": "/llms.txt"
  }
}
