{
  "@context": "https://urn-solid.github.io/context.jsonld",
  "@id": "urn:solid:updated",
  "@type": "rdf:Property",
  "rdfs:label": "updated",
  "rdfs:comment": "The date and time the object was last updated.",
  "owl:sameAs": "https://www.w3.org/ns/activitystreams#updated",
  "rdfs:seeAlso": [
    "urn:solid:modified",
    "urn:solid:published"
  ],
  "rdfs:range": "http://www.w3.org/2001/XMLSchema#dateTime",
  "notToBeConfusedWith": [
    "urn:solid:modified",
    "urn:solid:published"
  ],
  "status": "stable",
  "added": "2026-04-18",
  "notes": "ActivityStreams' last-edit timestamp. Functionally equivalent to `dcterms:modified` (`urn:solid:modified`), but stays in the AS namespace for ActivityPub-flavored data. ISO 8601 `xsd:dateTime`. Pair with `urn:solid:published` (first-published time).",
  "examples": [
    {
      "title": "Note with publication and update timestamps",
      "jsonld": {
        "@context": "https://urn-solid.github.io/context.jsonld",
        "@id": "https://example.org/notes/abc",
        "@type": "urn:solid:Note",
        "urn:solid:published": "2026-04-18T10:00:00Z",
        "urn:solid:updated": "2026-04-18T11:30:00Z"
      }
    }
  ],
  "provenance": {
    "sources": [
      "https://www.w3.org/ns/activitystreams#updated"
    ],
    "curatedBy": "claude-curate-next"
  },
  "history": [
    {
      "event": "added",
      "at": "2026-04-18T00:00:00Z",
      "by": "claude-curate-next",
      "note": "Initial term."
    }
  ],
  "see_also": {
    "corpus": "/corpus.jsonl",
    "schema": "/schema/term.schema.json",
    "index": "/index.json",
    "llms": "/llms.txt"
  }
}
