{
  "@context": "https://urn-solid.github.io/context.jsonld",
  "@id": "urn:solid:dateSubmitted",
  "@type": "rdf:Property",
  "rdfs:label": "dateSubmitted",
  "rdfs:comment": "The date the resource was formally submitted — typically to a publisher, conference, or review process.",
  "owl:sameAs": "http://purl.org/dc/terms/dateSubmitted",
  "rdfs:seeAlso": [
    "urn:solid:dateAccepted",
    "urn:solid:issued"
  ],
  "rdfs:range": "http://www.w3.org/2001/XMLSchema#date",
  "status": "stable",
  "added": "2026-04-19",
  "notes": "Pair with `urn:solid:dateAccepted` and `urn:solid:issued` for the full submission → review → publication timeline. Common in academic publishing, grant applications, RFC processes. ISO 8601 date.",
  "examples": [
    {
      "title": "Paper with submission date",
      "jsonld": {
        "@context": "https://urn-solid.github.io/context.jsonld",
        "@id": "https://example.org/papers/42",
        "@type": "urn:solid:Document",
        "urn:solid:dateSubmitted": "2026-01-15",
        "urn:solid:dateAccepted": "2026-03-04"
      }
    }
  ],
  "provenance": {
    "sources": [
      "http://purl.org/dc/terms/dateSubmitted"
    ],
    "curatedBy": "claude-curate-next"
  },
  "history": [
    {
      "event": "added",
      "at": "2026-04-19T00:00:00Z",
      "by": "claude-curate-next",
      "note": "Initial term."
    }
  ],
  "see_also": {
    "corpus": "/corpus.jsonl",
    "schema": "/schema/term.schema.json",
    "index": "/index.json",
    "llms": "/llms.txt"
  }
}
